FilmID,Writer,Actors,Plot,Language,Country,Awards,Poster
tt0053125,Ernest Lehman,"Cary Grant, Eva Marie Saint, James Mason","A New York City advertising executive goes on the run after being mistaken for a government agent by a group of foreign spies, and falls for a woman whose loyalties he begins to doubt.","English, French",United States,Nominated for 3 Oscars. 8 wins & 10 nominations total,https://m.media-amazon.com/images/M/MV5BZDA3NDExMTUtMDlhOC00MmQ5LWExZGUtYmI1NGVlZWI4OWNiXkEyXkFqcGdeQXVyNjc1NTYyMjg@._V1_SX300.jpg
tt0073195,"Peter Benchley, Carl Gottlieb","Roy Scheider, Robert Shaw, Richard Dreyfuss","When a killer shark unleashes chaos on a beach community off Long Island, it's up to a local sheriff, a marine biologist, and an old seafarer to hunt the beast down.",English,United States,Won 3 Oscars. 15 wins & 20 nominations total,https://m.media-amazon.com/images/M/MV5BMmVmODY1MzEtYTMwZC00MzNhLWFkNDMtZjAwM2EwODUxZTA5XkEyXkFqcGdeQXVyNTAyODkwOQ@@._V1_SX300.jpg
tt0075148,Sylvester Stallone,"Sylvester Stallone, Talia Shire, Burt Young",A small-time Philadelphia boxer gets a supremely rare chance to fight the world heavyweight champion in a bout in which he strives to go the distance for his self-respect.,English,United States,Won 3 Oscars. 20 wins & 22 nominations total,https://m.media-amazon.com/images/M/MV5BMTY5MDMzODUyOF5BMl5BanBnXkFtZTcwMTQ3NTMyNA@@._V1_SX300.jpg
tt0015864,Charles Chaplin,"Charles Chaplin, Mack Swain, Tom Murray","A prospector goes to the Klondike during the 1890s gold rush in hopes of making his fortune, and is smitten with a girl he sees in a dance hall.",English,United States,Nominated for 2 Oscars. 3 wins & 3 nominations total,https://m.media-amazon.com/images/M/MV5BZjEyOTE4MzMtNmMzMy00Mzc3LWJlOTQtOGJiNDE0ZmJiOTU4L2ltYWdlXkEyXkFqcGdeQXVyNTAyODkwOQ@@._V1_SX300.jpg
tt0073440,Joan Tewkesbury,"Keith Carradine, Karen Black, Ronee Blakley","Over the course of a few hectic days, numerous interrelated people prepare for a political convention.",English,United States,Won 1 Oscar. 24 wins & 26 nominations total,https://m.media-amazon.com/images/M/MV5BMDY0MzE3YWQtZTAzMS00ZmRlLWE3NzYtMjk0NDlkMmE4N2U2XkEyXkFqcGdeQXVyMTAwMzUyOTc@._V1_SX300.jpg
tt0023969,"Bert Kalmar, Harry Ruby, Arthur Sheekman","Groucho Marx, Harpo Marx, Chico Marx","Rufus T. Firefly is named the dictator of bankrupt Freedonia and declares war on neighboring Sylvania over the love of his wealthy backer Mrs. Teasdale, contending with two inept spies who can't seem to keep straight which side they'",English,United States,2 wins & 2 nominations,https://m.media-amazon.com/images/M/MV5BYmYxZGU2NWYtNzQxZS00NmEyLWIzN2YtMDk5MWM0ODc5ZTE4XkEyXkFqcGdeQXVyNTA4NzY1MzY@._V1_SX300.jpg
tt0034240,Preston Sturges,"Joel McCrea, Veronica Lake, Robert Warwick",Hollywood director John L Sullivan sets out to experience life as a homeless person in order to gain relevant life experience for his next movie.,English,United States,2 wins,https://m.media-amazon.com/images/M/MV5BYWUyYTFlMzUtYzUxNi00YjFhLWEyNzItMzdkZTNkNDE5OTFlXkEyXkFqcGdeQXVyMzg1ODEwNQ@@._V1_SX300.jpg
tt0069704,"George Lucas, Gloria Katz, Willard Huyck","Richard Dreyfuss, Ron Howard, Paul Le Mat",A group of teenagers in California's central valley spend one final night after their 1962 high school graduation cruising the strip with their buddies before they pursue their varying goals.,English,United States,Nominated for 5 Oscars. 9 wins & 13 nominations total,https://m.media-amazon.com/images/M/MV5BMjI5NjM5MjIyNF5BMl5BanBnXkFtZTgwNjg2MTUxMDE@._V1_SX300.jpg
tt0068327,"Joe Masteroff, John Van Druten, Christopher Isherwood","Liza Minnelli, Michael York, Helmut Griem",A female girlie club entertainer in Weimar Republic era Berlin romances two men while the Nazi Party rises to power around them.,"English, German, Hebrew, French",United States,Won 8 Oscars. 39 wins & 18 nominations total,https://m.media-amazon.com/images/M/MV5BNTEyMzc0Mjk5MV5BMl5BanBnXkFtZTgwMjI2NDIwMTE@._V1_SX300.jpg
tt0074958,Paddy Chayefsky,"Faye Dunaway, William Holden, Peter Finch","A television network cynically exploits a deranged former anchor's ravings and revelations about the news media for its own profit, but finds that his message may be difficult to control.",English,United States,Won 4 Oscars. 20 wins & 26 nominations total,https://m.media-amazon.com/images/M/MV5BZGNjYjM2MzItZGQzZi00NmY3LTgxOGUtMTQ2MWQxNWQ2MmMwXkEyXkFqcGdeQXVyNzM0MTUwNTY@._V1_SX300.jpg
tt0043265,"C.S. Forester, James Agee, John Huston","Humphrey Bogart, Katharine Hepburn, Robert Morley","In WWI East Africa, a gin-swilling Canadian riverboat captain is persuaded by a strait-laced English missionary to undertake a trip up a treacherous river and use his boat to attack a German gunship.","English, German, Swahili","United Kingdom, United States",Won 1 Oscar. 5 wins & 8 nominations total,https://m.media-amazon.com/images/M/MV5BYzM3YjE2NGMtODY3Zi00NTY0LWE4Y2EtMTE5YzNmM2U1NTg2XkEyXkFqcGdeQXVyMTY5Nzc4MDY@._V1_SX300.jpg
tt0082971,"Lawrence Kasdan, George Lucas, Philip Kaufman","Harrison Ford, Karen Allen, Paul Freeman","In 1936, archaeologist and adventurer Indiana Jones is hired by the U.S. government to find the Ark of the Covenant before Adolf Hitler's Nazis can obtain its awesome powers.","English, German, Hebrew, Spanish, Arabic, Nepali",United States,Won 5 Oscars. 37 wins & 24 nominations total,https://m.media-amazon.com/images/M/MV5BMjA0ODEzMTc1Nl5BMl5BanBnXkFtZTcwODM2MjAxNA@@._V1_SX300.jpg
tt0061184,"Ernest Lehman, Edward Albee","Elizabeth Taylor, Richard Burton, George Segal","A bitter middle-aged couple, her derisive of his lowly position at a New England college, ask a new colleague and his wife over for drinks, and use them to fuel anguish and emotional pain toward each other through a distressing night","English, Latin, Spanish",United States,Won 5 Oscars. 22 wins & 28 nominations total,https://m.media-amazon.com/images/M/MV5BMjQ5ODI1MjQtMDc0Zi00OGQ1LWE2NTYtMTg1YTkxM2E5NzFkXkEyXkFqcGdeQXVyNTA4NzY1MzY@._V1_SX300.jpg
tt0105695,David Webb Peoples,"Clint Eastwood, Gene Hackman, Morgan Freeman","Retired Old West gunslinger William Munny reluctantly takes on one last job, with the help of his old partner Ned Logan and a young man, The ""Schofield Kid.""",English,United States,Won 4 Oscars. 50 wins & 47 nominations total,https://m.media-amazon.com/images/M/MV5BODM3YWY4NmQtN2Y3Ni00OTg0LWFhZGQtZWE3ZWY4MTJlOWU4XkEyXkFqcGdeQXVyNjU0OTQ0OTY@._V1_SX300.jpg
tt0084805,"Don McGuire, Larry Gelbart, Murray Schisgal","Dustin Hoffman, Jessica Lange, Teri Garr","Michael Dorsey, an unsuccessful actor, disguises himself as a woman in order to get a role on a trashy hospital soap.",English,United States,Won 1 Oscar. 25 wins & 30 nominations total,https://m.media-amazon.com/images/M/MV5BMTY4MGJjMTktNGM4Ni00ODliLWJlYjQtNjc4NmY2NjQ3NzEzXkEyXkFqcGdeQXVyMTA0MjU0Ng@@._V1_SX300.jpg
tt0066921,"Stanley Kubrick, Anthony Burgess","Malcolm McDowell, Patrick Magee, Michael Bates","In the future, a sadistic gang leader is imprisoned and volunteers for a conduct-aversion experiment, but it doesn't go as planned.",English,"United Kingdom, United States",Nominated for 4 Oscars. 12 wins & 24 nominations total,https://m.media-amazon.com/images/M/MV5BMTY3MjM1Mzc4N15BMl5BanBnXkFtZTgwODM0NzAxMDE@._V1_SX300.jpg
tt0120815,Robert Rodat,"Tom Hanks, Matt Damon, Tom Sizemore","Following the Normandy Landings, a group of U.S. soldiers go behind enemy lines to retrieve a paratrooper whose brothers have been killed in action.","English, French, German, Czech",United States,Won 5 Oscars. 79 wins & 75 nominations total,https://m.media-amazon.com/images/M/MV5BZjhkMDM4MWItZTVjOC00ZDRhLThmYTAtM2I5NzBmNmNlMzI1XkEyXkFqcGdeQXVyNDYyMDk5MTU@._V1_SX300.jpg
tt0111161,"Stephen King, Frank Darabont","Tim Robbins, Morgan Freeman, Bob Gunton","Two imprisoned men bond over a number of years, finding solace and eventual redemption through acts of common decency.",English,United States,Nominated for 7 Oscars. 21 wins & 43 nominations total,https://m.media-amazon.com/images/M/MV5BMDFkYTc0MGEtZmNhMC00ZDIzLWFmNTEtODM1ZmRlYWMwMWFmXkEyXkFqcGdeQXVyMTMxODk2OTU@._V1_SX300.jpg
tt0064115,William Goldman,"Paul Newman, Robert Redford, Katharine Ross","Wyoming, early 1900s. Butch Cassidy and The Sundance Kid are the leaders of a band of outlaws. After a train robbery goes wrong they find themselves on the run with a posse hard on their heels. Their solution - escape to Bolivia.","English, Spanish","United States, Mexico",Won 4 Oscars. 21 wins & 15 nominations total,https://m.media-amazon.com/images/M/MV5BMTkyMTM2NDk5Nl5BMl5BanBnXkFtZTgwNzY1NzEyMDE@._V1_SX300.jpg
tt0102926,"Thomas Harris, Ted Tally","Jodie Foster, Anthony Hopkins, Lawrence A. Bonney","A young F.B.I. cadet must receive the help of an incarcerated and manipulative cannibal killer to help catch another serial killer, a madman who skins his victims.","English, Latin",United States,Won 5 Oscars. 69 wins & 51 nominations total,https://m.media-amazon.com/images/M/MV5BNjNhZTk0ZmEtNjJhMi00YzFlLWE1MmEtYzM1M2ZmMGMwMTU4XkEyXkFqcGdeQXVyNjU0OTQ0OTY@._V1_SX300.jpg
tt0061811,"Stirling Silliphant, John Ball","Sidney Poitier, Rod Steiger, Warren Oates","A black Philadelphia police detective is mistakenly suspected of a local murder while passing through a racially hostile Mississippi town, and after being cleared is reluctantly asked by the police chief to investigate the case.",English,United States,Won 5 Oscars. 23 wins & 15 nominations total,https://m.media-amazon.com/images/M/MV5BZjZhZTZkNWItZGE1My00MTRkLWI2ZDktMWZkZTIxZWYxOTgzXkEyXkFqcGdeQXVyNDY2MTk1ODk@._V1_SX300.jpg
tt0109830,"Winston Groom, Eric Roth","Tom Hanks, Robin Wright, Gary Sinise","The presidencies of Kennedy and Johnson, the Vietnam War, the Watergate scandal and other historical events unfold from the perspective of an Alabama man with an IQ of 75, whose only desire is to be reunited with his childhood sweeth",English,United States,Won 6 Oscars. 50 wins & 75 nominations total,https://m.media-amazon.com/images/M/MV5BNWIwODRlZTUtY2U3ZS00Yzg1LWJhNzYtMmZiYmEyNmU1NjMzXkEyXkFqcGdeQXVyMTQxNzMzNDI@._V1_SX300.jpg
tt0074119,"Carl Bernstein, Bob Woodward, William Goldman","Dustin Hoffman, Robert Redford, Jack Warden","""The Washington Post"" reporters Bob Woodward and Carl Bernstein uncover the details of the Watergate scandal that leads to President Richard Nixon's resignation.","English, Spanish",United States,Won 4 Oscars. 17 wins & 21 nominations total,https://m.media-amazon.com/images/M/MV5BOWI2YWQxM2MtY2U4Yi00YjgzLTgwNzktN2ExNTgzNTIzMmUzXkEyXkFqcGdeQXVyMTAwMzUyOTc@._V1_SX300.jpg
tt0027977,Charles Chaplin,"Charles Chaplin, Paulette Goddard, Henry Bergman",The Tramp struggles to live in modern industrial society with the help of a young homeless woman.,English,United States,4 wins & 1 nomination,https://m.media-amazon.com/images/M/MV5BYjJiZjMzYzktNjU0NS00OTkxLWEwYzItYzdhYWJjN2QzMTRlL2ltYWdlL2ltYWdlXkEyXkFqcGdeQXVyNjU0OTQ0OTY@._V1_SX300.jpg
tt0065214,"Walon Green, Sam Peckinpah, Roy N. Sickner","William Holden, Ernest Borgnine, Robert Ryan","An aging group of outlaws look for one last big score as the ""traditional"" American West is disappearing around them.","English, Spanish, German",United States,Nominated for 2 Oscars. 6 wins & 8 nominations total,https://m.media-amazon.com/images/M/MV5BNGUyYTZmOWItMDJhMi00N2IxLWIyNDMtNjUxM2ZiYmU5YWU1XkEyXkFqcGdeQXVyNjc1NTYyMjg@._V1_SX300.jpg
tt0053604,"Billy Wilder, I.A.L. Diamond","Jack Lemmon, Shirley MacLaine, Fred MacMurray","A Manhattan insurance clerk tries to rise in his company by letting its executives use his apartment for trysts, but complications and a romance of his own ensue.",English,United States,Won 5 Oscars. 24 wins & 8 nominations total,https://m.media-amazon.com/images/M/MV5BNzkwODFjNzItMmMwNi00MTU5LWE2MzktM2M4ZDczZGM1MmViXkEyXkFqcGdeQXVyNDY2MTk1ODk@._V1_SX300.jpg
tt0054331,"Dalton Trumbo, Howard Fast, Peter Ustinov","Kirk Douglas, Laurence Olivier, Jean Simmons","The slave Spartacus survives brutal training as a gladiator and leads a violent revolt against the decadent Roman Republic, as the ambitious Crassus seeks to gain power by crushing the uprising.",English,United States,Won 4 Oscars. 12 wins & 11 nominations total,https://m.media-amazon.com/images/M/MV5BMjc4MTUxN2UtMmU1NC00MjQyLTk3YTYtZTQ0YzEzZDc0Njc0XkEyXkFqcGdeQXVyNjU0OTQ0OTY@._V1_SX300.jpg
tt0018455,"Carl Mayer, Hermann Sudermann, Katherine Hilliker","George O'Brien, Janet Gaynor, Margaret Livingston","A sophisticated urban woman seduces a farmer in the hopes that he will murder his neglected wife and join her in the city, but he soon finds himself rekindling his romance with the latter when she discovers their scheme.","None, English",United States,Won 3 Oscars. 6 wins & 2 nominations total,https://m.media-amazon.com/images/M/MV5BNDVkYmYwM2ItNzRiMy00NWQ4LTlhMjMtNDI1ZDYyOGVmMzJjXkEyXkFqcGdeQXVyNTgzMzU5MDI@._V1_SX300.jpg
tt0120338,James Cameron,"Leonardo DiCaprio, Kate Winslet, Billy Zane","A seventeen-year-old aristocrat falls in love with a kind but poor artist aboard the luxurious, ill-fated R.M.S. Titanic.","English, Swedish, Italian, French","United States, Mexico",Won 11 Oscars. 125 wins & 83 nominations total,https://m.media-amazon.com/images/M/MV5BMDdmZGU3NDQtY2E5My00ZTliLWIzOTUtMTY4ZGI1YjdiNjk3XkEyXkFqcGdeQXVyNTA4NzY1MzY@._V1_SX300.jpg
tt0064276,"Peter Fonda, Dennis Hopper, Terry Southern","Peter Fonda, Dennis Hopper, Jack Nicholson","Two bikers head from L.A. to New Orleans through the open country and desert lands, and along the way they meet a man who bridges a counter-culture gap of which they had been unaware.","English, Spanish, Greek, Ancient (to 1453)",United States,Nominated for 2 Oscars. 8 wins & 14 nominations total,https://m.media-amazon.com/images/M/MV5BMTc2MjI2NDc4Ml5BMl5BanBnXkFtZTgwODI4NzU0MTI@._V1_SX300.jpg
tt0026778,"George S. Kaufman, Morrie Ryskind, James Kevin McGuinness","Groucho Marx, Chico Marx, Harpo Marx",A sly business manager and the wacky friends of two opera singers in Italy help them achieve success in America while humiliating their stuffy and snobbish enemies.,"English, Italian",United States,1 win,https://m.media-amazon.com/images/M/MV5BYTJmNmQxNGItNDNlMC00MDU3LWFhNzMtZDQ2NDY0ZTVkNjE3XkEyXkFqcGdeQXVyMDI2NDg0NQ@@._V1_SX300.jpg
tt0091763,Oliver Stone,"Charlie Sheen, Tom Berenger, Willem Dafoe","Chris Taylor, a neophyte recruit in Vietnam, finds himself caught in a battle of wills between two sergeants, one good and the other evil. A shrewd examination of the brutality of war and the duality of man in conflict.","English, Vietnamese","United States, United Kingdom",Won 4 Oscars. 24 wins & 15 nominations total,https://m.media-amazon.com/images/M/MV5BNTU3NzY4ODY5MF5BMl5BanBnXkFtZTcwOTkzNzE1NA@@._V1_SX300.jpg
tt0050083,Reginald Rose,"Henry Fonda, Lee J. Cobb, Martin Balsam",The jury in a New York City murder trial is frustrated by a single member whose skeptical caution forces them to more carefully consider the evidence before jumping to a hasty verdict.,English,United States,Nominated for 3 Oscars. 17 wins & 13 nominations total,https://m.media-amazon.com/images/M/MV5BMWU4N2FjNzYtNTVkNC00NzQ0LTg0MjAtYTJlMjFhNGUxZDFmXkEyXkFqcGdeQXVyNjc1NTYyMjg@._V1_SX300.jpg
tt0029947,"Dudley Nichols, Hagar Wilde","Katharine Hepburn, Cary Grant, Charles Ruggles","While trying to secure a $1 million donation for his museum, a befuddled paleontologist is pursued by a flighty and often irritating heiress and her pet leopard, Baby.",English,United States,2 wins,https://m.media-amazon.com/images/M/MV5BMmVkOTRiYmItZjE4NS00MWNjLWE0ZmMtYzg5YzFjMjMyY2RkXkEyXkFqcGdeQXVyNjc1NTYyMjg@._V1_SX300.jpg
tt0167404,M. Night Shyamalan,"Bruce Willis, Haley Joel Osment, Toni Collette","A frightened, withdrawn Philadelphia boy who communicates with spirits seeks the help of a disheartened child psychologist.","English, Latin, Spanish",United States,Nominated for 6 Oscars. 37 wins & 56 nominations total,https://m.media-amazon.com/images/M/MV5BMWM4NTFhYjctNzUyNi00NGMwLTk3NTYtMDIyNTZmMzRlYmQyXkEyXkFqcGdeQXVyMTAwMzUyOTc@._V1_SX300.jpg
tt0028333,"Howard Lindsay, Allan Scott, Erwin Gelsey","Fred Astaire, Ginger Rogers, Victor Moore","Roguish gambler/dancer ""Lucky"" Garnett is challenged by his fiance's father to come up with $25,000 to prove he's worthy of her hand. But after he falls in love with a dance instructor, Lucky'll do anything to keep from earning the b","English, French",United States,Won 1 Oscar. 2 wins & 3 nominations total,https://m.media-amazon.com/images/M/MV5BZWEwNjhlMzYtOGU3Ni00OTg3LWFjOWUtOTg0MDk3M2U0ODk1XkEyXkFqcGdeQXVyMTY5Nzc4MDY@._V1_SX300.jpg
tt0084707,"William Styron, Alan J. Pakula","Meryl Streep, Kevin Kline, Peter MacNicol","Sophie is the survivor of Nazi concentration camps, who has found a reason to live with Nathan, a sparkling if unsteady American Jew obsessed with the Holocaust.","English, Polish, German, French, Russian","United Kingdom, United States",Won 1 Oscar. 13 wins & 12 nominations total,https://m.media-amazon.com/images/M/MV5BMTk3NDUyYTEtMzkyZi00YjMzLTkwMDUtYWMzNjIwNmM5NWQ5XkEyXkFqcGdeQXVyMTQxNzMzNDI@._V1_SX300.jpg
tt0099685,"Nicholas Pileggi, Martin Scorsese","Robert De Niro, Ray Liotta, Joe Pesci","The story of Henry Hill and his life in the mob, covering his relationship with his wife Karen Hill and his mob partners Jimmy Conway and Tommy DeVito in the Italian-American crime syndicate.","English, Italian",United States,Won 1 Oscar. 44 wins & 38 nominations total,https://m.media-amazon.com/images/M/MV5BY2NkZjEzMDgtN2RjYy00YzM1LWI4ZmQtMjIwYjFjNmI3ZGEwXkEyXkFqcGdeQXVyNzkwMjQ5NzM@._V1_SX300.jpg
tt0067116,"Ernest Tidyman, Robin Moore","Gene Hackman, Roy Scheider, Fernando Rey","A pair of NYPD detectives in the Narcotics Bureau stumble onto a heroin smuggling ring based in Marseilles, but stopping them and capturing their leaders proves an elusive goal.","English, French",United States,Won 5 Oscars. 22 wins & 12 nominations total,https://m.media-amazon.com/images/M/MV5BOTZhY2E3NmItMGIwNi00OTA2LThkYmEtODFiZTM0NGI0ZWU5XkEyXkFqcGdeQXVyNTc1NTQxODI@._V1_SX300.jpg
tt0110912,"Quentin Tarantino, Roger Avary","John Travolta, Uma Thurman, Samuel L. Jackson","The lives of two mob hitmen, a boxer, a gangster and his wife, and a pair of diner bandits intertwine in four tales of violence and redemption.","English, Spanish, French",United States,Won 1 Oscar. 70 wins & 75 nominations total,https://m.media-amazon.com/images/M/MV5BNGNhMDIzZTUtNTBlZi00MTRlLWFjM2ItYzViMjE3YzI5MjljXkEyXkFqcGdeQXVyNzkwMjQ5NzM@._V1_SX300.jpg
tt0067328,"Larry McMurtry, Peter Bogdanovich","Timothy Bottoms, Jeff Bridges, Cybill Shepherd","In 1951, a group of high schoolers come of age in a bleak, isolated, atrophied North Texas town that is slowly dying, both culturally and economically.",English,United States,Won 2 Oscars. 19 wins & 22 nominations total,https://m.media-amazon.com/images/M/MV5BNmVjNzZkZjQtYmM5ZC00M2I0LWJhNzktNDk3MGU1NWMxMjFjXkEyXkFqcGdeQXVyNjc1NTYyMjg@._V1_SX300.jpg
tt0097216,Spike Lee,"Danny Aiello, Ossie Davis, Ruby Dee","On the hottest day of the year on a street in the Bedford-Stuyvesant section of Brooklyn, everyone's hate and bigotry smolders and builds until it explodes into violence.","English, Italian, Spanish, Korean",United States,Nominated for 2 Oscars. 21 wins & 17 nominations total,https://m.media-amazon.com/images/M/MV5BODA2MjU1NTI1MV5BMl5BanBnXkFtZTgwOTU4ODIwMjE@._V1_SX300.jpg
tt0083658,"Hampton Fancher, David Webb Peoples, Philip K. Dick","Harrison Ford, Rutger Hauer, Sean Young","A blade runner must pursue and terminate four replicants who stole a ship in space, and have returned to Earth to find their creator.","English, German, Cantonese, Japanese, Hungarian, Arabic, Korean",United States,Nominated for 2 Oscars. 12 wins & 19 nominations total,https://m.media-amazon.com/images/M/MV5BNzQzMzJhZTEtOWM4NS00MTdhLTg0YjgtMjM4MDRkZjUwZDBlXkEyXkFqcGdeQXVyNjU0OTQ0OTY@._V1_SX300.jpg
tt0035575,"Robert Buckner, Edmund Joseph, Julius J. Epstein","James Cagney, Joan Leslie, Walter Huston","The life of the renowned musical composer, playwright, actor, dancer, and singer George M. Cohan.",English,United States,Won 3 Oscars. 6 wins & 6 nominations total,https://m.media-amazon.com/images/M/MV5BNDQ2MWJjNjUtYmVlNS00YjUzLWFkMDEtYzE2MjkxOTljMmI1XkEyXkFqcGdeQXVyNjc1NTYyMjg@._V1_SX300.jpg
tt0114709,"John Lasseter, Pete Docter, Andrew Stanton","Tom Hanks, Tim Allen, Don Rickles",A cowboy doll is profoundly threatened and jealous when a new spaceman figure supplants him as top toy in a boy's room.,English,United States,Won 1 Oscar. 27 wins & 23 nominations total,https://m.media-amazon.com/images/M/MV5BMDU2ZWJlMjktMTRhMy00ZTA5LWEzNDgtYmNmZTEwZTViZWJkXkEyXkFqcGdeQXVyNDQ2OTk4MzI@._V1_SX300.jpg
tt0052618,"Lew Wallace, Karl Tunberg, Gore Vidal","Charlton Heston, Jack Hawkins, Stephen Boyd","After a Jewish prince is betrayed and sent into slavery by a Roman friend in 1st-century Jerusalem, he regains his freedom and comes back for revenge.",English,United States,Won 11 Oscars. 29 wins & 16 nominations total,https://m.media-amazon.com/images/M/MV5BNjgxY2JiZDYtZmMwOC00ZmJjLWJmODUtMTNmNWNmYWI5ODkwL2ltYWdlL2ltYWdlXkEyXkFqcGdeQXVyNjc1NTYyMjg@._V1_SX300.jpg